CODIGO_RUC,nombre_empresa_1a,n_obras_asociadas_1a,n_registros_1a,es_consorcio,flag_sancionadas_tce,flag_inhabilitadas_pj,flag_sancionadas_rnp,flag_inhabilitadas_rnp,flag_impedidas_rnp,nombre_empresa_2a,capacidad_maxima_contratacion,capacidad_libre_contratacion,estado_empresa,condicion_empresa,numero_sanciones_tce,numero_sanciones_rnp,flag_fecha_constitucion_alerta,flag_ley_selva_alerta,flag_accionistas_alerta,n_obras_representante,n_representantes_legales,representante_legal_principal,NOMBRE_EMPRESA,risk_score_proxy,y_riesgo_empresa_4niveles,n_vinculos_total,n_contrapartes_unicas,n_veces_ganador,n_veces_participante,ratio_ganador,ratio_participante,n_registros_hora_oferta,n_horas_oferta_distintas,hora_oferta_moda
10001046191,CONSULTORES ASOCIADOS DEL ORIENTE,1,1,1,0,0,0,0,0,CONSULTORES ASOCIADOS DEL ORIENTE,,0.0,ACTIVO,HABIDO,0,0,0,0,0,,,,CONSULTORES ASOCIADOS DEL ORIENTE,0,0,19,13,9,10,0.47368421052631576,0.5263157894736842,0.0,0.0,
10011010534,DELGADO VASQUEZ GEICEN BLADISLAV(*),1,1,1,0,0,0,0,0,DELGADO VASQUEZ GEICEN BLADISLAV(*),,0.0,ACTIVO,HABIDO,0,0,0,0,0,,,,DELGADO VASQUEZ GEICEN BLADISLAV(*),0,0,17,15,15,2,0.8823529411764706,0.11764705882352941,0.0,0.0,
10011217104,CONSORCIO CONSULTOR B3,1,1,1,0,0,0,0,0,CONSORCIO CONSULTOR B3,,0.0,ACTIVO,HABIDO,0,0,0,0,0,1.0,2.0,SIMON MUCHA MONICA LUZ,CONSORCIO CONSULTOR B3,0,0,26,23,20,6,0.7692307692307693,0.23076923076923078,0.0,0.0,
10011600447,CHAVEZ BRAVO DAGOBERTO,1,1,0,0,0,0,0,0,CHAVEZ BRAVO DAGOBERTO,,0.0,ACTIVO,HABIDO,0,0,0,0,0,,,,CHAVEZ BRAVO DAGOBERTO,0,0,4,3,1,3,0.25,0.75,0.0,0.0,
10020343112,TICONA VARGAS TOMAS(*),3,3,1,0,0,0,0,0,TICONA VARGAS TOMAS(*),,0.0,ACTIVO,HABIDO,0,0,0,0,0,2.0,1.0,BECERRA GUEVARA RICARDO LENIN,TICONA VARGAS TOMAS(*),0,0,28,15,19,9,0.6785714285714286,0.32142857142857145,0.0,0.0,
10021511116,ROJAS MAMANI DIONISIO(*),4,4,1,0,0,0,0,0,ROJAS MAMANI DIONISIO(*),,0.0,ACTIVO,HABIDO,0,0,0,0,0,1.0,3.0,LUCEN CHAVEZ JORGE ENRIQUE,ROJAS MAMANI DIONISIO(*),0,0,36,13,25,11,0.6944444444444444,0.3055555555555556,0.0,0.0,
10024475005,CONSORCIO SUPERVISION ACROMEL,1,1,1,0,0,0,0,0,CONSORCIO SUPERVISION ACROMEL,,0.0,ACTIVO,HABIDO,0,0,0,0,0,,,,CONSORCIO SUPERVISION ACROMEL,0,0,14,11,9,5,0.6428571428571429,0.35714285714285715,0.0,0.0,
10031271369,CALLE RENTERIA VICTOR AUGUSTO(*),1,1,1,0,0,0,0,0,CALLE RENTERIA VICTOR AUGUSTO(*),,0.0,ACTIVO,HABIDO,0,0,0,0,0,,,,CALLE RENTERIA VICTOR AUGUSTO(*),0,0,10,7,2,8,0.2,0.8,0.0,0.0,
10034844262,CONSORCIO CHECASULLU,1,1,1,0,0,0,0,0,CONSORCIO CHECASULLU,,0.0,ACTIVO,HABIDO,0,0,0,0,0,,,,CONSORCIO CHECASULLU,0,0,6,4,4,2,0.6666666666666666,0.3333333333333333,0.0,0.0,
10050716606,MAMANI TTITO VIDAL AMERICO,1,1,0,0,0,0,0,0,MAMANI TTITO VIDAL AMERICO,,0.0,ACTIVO,HABIDO,0,0,0,0,0,,,,MAMANI TTITO VIDAL AMERICO,0,0,12,10,5,7,0.4166666666666667,0.5833333333333334,0.0,0.0,
10053721350,PEÑA CORAL FERNANDO(*),3,3,1,0,0,0,0,0,PEÑA CORAL FERNANDO(*),,0.0,ACTIVO,HABIDO,0,0,0,0,0,2.0,3.0,CASTILLO DIAZ ORLANDO,PEÑA CORAL FERNANDO(*),0,0,38,28,28,10,0.7368421052631579,0.2631578947368421,1.0,1.0,8:30
10060786581,REYES MORAN OSCAR IGNACIO(*),1,1,1,0,0,0,0,0,REYES MORAN OSCAR IGNACIO(*),,0.0,ACTIVO,HABIDO,0,0,0,0,0,1.0,1.0,MENOR BALLADARES ENRIQUE,REYES MORAN OSCAR IGNACIO(*),0,0,8,6,6,2,0.75,0.25,0.0,0.0,
10062352529,RIOS PADILLA ANA BERTHA(*),1,1,1,0,0,0,0,0,RIOS PADILLA ANA BERTHA(*),,0.0,ACTIVO,HABIDO,0,0,0,1,0,,,,RIOS PADILLA ANA BERTHA(*),1,1,11,9,7,4,0.6363636363636364,0.36363636363636365,0.0,0.0,
10070675043,CONSORCIO SAN JOSE,2,2,1,0,0,0,0,0,CONSORCIO SAN JOSE,,0.0,ACTIVO,HABIDO,0,0,0,0,0,1.0,1.0,VILA CELAYA JOSE MANUEL,CONSORCIO SAN JOSE,0,0,19,13,14,5,0.7368421052631579,0.2631578947368421,0.0,0.0,
10071641274,CONSORCIO SUPERVISOR ALPHA,1,1,1,0,0,0,0,0,CONSORCIO SUPERVISOR ALPHA,,0.0,ACTIVO,HABIDO,0,0,0,0,0,1.0,2.0,CONDORHUAMAN SUPA JESUS DANIEL,CONSORCIO SUPERVISOR ALPHA,0,0,12,9,8,4,0.6666666666666666,0.3333333333333333,0.0,0.0,
10073875299,CONSORCIO CONSULTOR AQUA LURÍN,1,1,1,0,0,0,0,0,CONSORCIO CONSULTOR AQUA LURÍN,,0.0,ACTIVO,NO HALLADO,0,0,0,0,0,,,,CONSORCIO CONSULTOR AQUA LURÍN,0,0,13,11,10,3,0.7692307692307693,0.23076923076923078,0.0,0.0,
10075332730,FIGUEROA CORNEJO JORGE ERNESTO(*),1,1,1,0,0,0,0,0,FIGUEROA CORNEJO JORGE ERNESTO(*),,0.0,ACTIVO,HABIDO,0,0,0,0,0,,,,FIGUEROA CORNEJO JORGE ERNESTO(*),0,0,4,2,2,2,0.5,0.5,1.0,1.0,8:30
10076050134,CONSORCIO MONARCA,1,1,1,0,0,0,0,0,CONSORCIO MONARCA,,0.0,BAJA DE OFICIO,HABIDO,0,0,0,0,0,,,,CONSORCIO MONARCA,0,0,11,8,3,8,0.2727272727272727,0.7272727272727273,0.0,0.0,
10079403402,CONSORCIO TACNA,2,2,1,0,0,0,0,0,CONSORCIO TACNA,,0.0,ACTIVO,HABIDO,0,0,0,0,0,2.0,1.0,CANGO CORO DILANIA,CONSORCIO TACNA,0,0,24,17,19,5,0.7916666666666666,0.20833333333333334,0.0,0.0,
10081070062,ZAVALA LAGOS VICTOR HUGO(*),1,1,1,0,0,0,0,0,ZAVALA LAGOS VICTOR HUGO(*),,0.0,ACTIVO,HABIDO,0,0,0,0,0,,,,ZAVALA LAGOS VICTOR HUGO(*),0,0,14,12,10,4,0.7142857142857143,0.2857142857142857,0.0,0.0,
10082789371,CONSORCIO CUMANÁ,2,2,1,0,0,0,0,0,ROMAN VASQUEZ BENITO URIBE,,0.0,ACTIVO,HABIDO,0,0,0,0,0,,,,CONSORCIO CUMANÁ,0,0,7,3,4,3,0.5714285714285714,0.42857142857142855,0.0,0.0,
10084453159,CONSORCIO CONSULTOR EL SAUCE,1,1,1,0,0,0,0,0,CONSORCIO CONSULTOR EL SAUCE,,0.0,ACTIVO,HABIDO,0,0,0,0,0,1.0,1.0,PADILLA PINCHI NATALY ROOS,CONSORCIO CONSULTOR EL SAUCE,0,0,6,4,4,2,0.6666666666666666,0.3333333333333333,0.0,0.0,
10085832943,CONSORCIO SUPERVISION QUIÑONES ET,1,1,1,0,0,0,0,0,CONSORCIO SUPERVISION QUIÑONES ET,,0.0,ACTIVO,HABIDO,0,0,0,0,0,,,,CONSORCIO SUPERVISION QUIÑONES ET,0,0,4,2,2,2,0.5,0.5,0.0,0.0,
10086838228,CONSORCIO CONSULTOR CARRION ,1,1,1,0,0,0,0,0,CONSORCIO CONSULTOR CARRION ,,0.0,ACTIVO,HABIDO,0,0,0,0,0,1.0,6.0,HUADO AVALOS MARCO ANTONIO,CONSORCIO CONSULTOR CARRION ,0,0,24,16,10,14,0.4166666666666667,0.5833333333333334,0.0,0.0,
10096049671,FERNANDEZ PERALTA WALTER MARCOS,1,1,0,0,0,0,0,0,FERNANDEZ PERALTA WALTER MARCOS,,0.0,ACTIVO,HABIDO,0,0,0,0,0,,,,FERNANDEZ PERALTA WALTER MARCOS,0,0,6,5,5,1,0.8333333333333334,0.16666666666666666,0.0,0.0,
10097262603,CONSORCIO TINGO MARIA,1,1,1,0,0,0,0,0,CONSORCIO TINGO MARIA,,0.0,ACTIVO,HABIDO,0,0,0,0,0,1.0,6.0,PRUDENCIO ROBLES WILDE ARTURO,CONSORCIO TINGO MARIA,0,0,8,4,4,4,0.5,0.5,0.0,0.0,
10098008875,CONSORCIO SUPERVISOR SAN JOSE,1,1,1,0,0,0,0,0,CONSORCIO SUPERVISOR SAN JOSE,,0.0,ACTIVO,HABIDO,0,0,0,0,0,1.0,1.0,MARTINEZ MERINO WILSON JOSE,CONSORCIO SUPERVISOR SAN JOSE,0,0,6,4,4,2,0.6666666666666666,0.3333333333333333,0.0,0.0,
10099284680,CONSULTORES ASOCIADOS DEL ORIENTE,2,2,1,0,0,0,0,0,LAM CONSULTORES,500000.0,-9930445.6,ACTIVO,HABIDO,0,0,0,0,0,,,,CONSULTORES ASOCIADOS DEL ORIENTE,0,0,21,10,13,8,0.6190476190476191,0.38095238095238093,0.0,0.0,
10099563490,DE LA TORRE MORENO EDUARD EFRAIN(*),3,3,1,0,0,0,0,0,DE LA TORRE MORENO EDUARD EFRAIN(*),,0.0,ACTIVO,HABIDO,0,0,0,0,0,2.0,1.0,VILA CELAYA JOSE MANUEL,DE LA TORRE MORENO EDUARD EFRAIN(*),0,0,23,13,16,7,0.6956521739130435,0.30434782608695654,0.0,0.0,
10101999039,DEXTRE MORIMOTO EDUARDO RAUL(*),3,3,1,0,0,0,0,0,DEXTRE MORIMOTO EDUARDO RAUL(*),,0.0,ACTIVO,HABIDO,0,0,0,0,0,,,,DEXTRE MORIMOTO EDUARDO RAUL(*),0,0,33,16,17,16,0.5151515151515151,0.48484848484848486,0.0,0.0,
10108686869,CROVETTO APARICIO CARLOS ALBERTO,1,1,0,0,0,0,0,0,CROVETTO APARICIO CARLOS ALBERTO,,0.0,ACTIVO,HABIDO,0,0,0,0,0,,,,CROVETTO APARICIO CARLOS ALBERTO,0,0,2,1,1,1,0.5,0.5,0.0,0.0,
10156781059,ESPIRITU GALVEZ JUAN DEMETRIO,1,1,0,0,0,0,0,0,ESPIRITU GALVEZ JUAN DEMETRIO,,0.0,ACTIVO,HABIDO,0,0,0,0,0,,,,ESPIRITU GALVEZ JUAN DEMETRIO,0,0,6,5,3,3,0.5,0.5,0.0,0.0,
10165700541,FERNANDEZ IDROGO SEGUNDO GRIMANIEL,3,3,1,0,0,0,0,0,FERNANDEZ IDROGO SEGUNDO GRIMANIEL(*),,0.0,ACTIVO,HABIDO,0,0,0,0,0,2.0,4.0,QUIROZ AYASTA FERNANDO,FERNANDEZ IDROGO SEGUNDO GRIMANIEL,0,0,82,68,63,19,0.7682926829268293,0.23170731707317074,0.0,0.0,
10166135899,BARBOZA ALCANTARA ENRIQUE,2,2,1,0,0,0,0,0,CONSORCIO SUPERVISOR AGUA,600000.0,600000.0,ACTIVO,HABIDO,0,0,0,0,0,1.0,6.0,ROMERO AMPUERO WILMAR RAUL,BARBOZA ALCANTARA ENRIQUE,0,0,107,73,99,8,0.9252336448598131,0.07476635514018691,0.0,0.0,
10166241141,CUBAS RUIZ JORGE NAPOLEON,1,1,0,0,0,0,0,0,CUBAS RUIZ JORGE NAPOLEON,43395440.18,24687858.02,ACTIVO,HABIDO,0,0,0,1,0,,,,CUBAS RUIZ JORGE NAPOLEON,1,1,27,26,26,1,0.9629629629629629,0.037037037037037035,0.0,0.0,
10167259702,CRUZ DAVILA MANUEL ANTONIO(*),1,1,1,0,0,0,0,0,CRUZ DAVILA MANUEL ANTONIO(*),,0.0,ACTIVO,HABIDO,0,0,0,0,0,1.0,2.0,PIZARRO ROMERO KATIA BEATRIZ,CRUZ DAVILA MANUEL ANTONIO(*),0,0,5,3,2,3,0.4,0.6,1.0,1.0,15:00
10175354374,MONTALVAN BERNAL WALTER JAVIER(*),2,2,1,0,0,0,0,0,MONTALVAN BERNAL WALTER JAVIER(*),,0.0,ACTIVO,HABIDO,0,0,0,0,0,1.0,4.0,VASQUEZ DELGADO KRISTIAN NOE,MONTALVAN BERNAL WALTER JAVIER(*),0,0,19,13,8,11,0.42105263157894735,0.5789473684210527,0.0,0.0,
10175607604,CONSORCIO JOAQUIN,1,1,1,0,0,0,0,0,CONSORCIO JOAQUIN,2032217.52,2032217.52,ACTIVO,HABIDO,0,0,0,0,0,,,,CONSORCIO JOAQUIN,0,0,5,3,3,2,0.6,0.4,0.0,0.0,
10178959251,CONSORCIO SUPERVISOR AREQUIPA,1,1,1,0,0,0,0,0,CONSORCIO SUPERVISOR AREQUIPA,,0.0,ACTIVO,HABIDO,0,0,0,0,0,1.0,3.0,VASQUEZ HUARCAYA DANY MANUEL,CONSORCIO SUPERVISOR AREQUIPA,0,0,9,5,4,5,0.4444444444444444,0.5555555555555556,0.0,0.0,
10181403212,CONSORCIO CARMELO,1,1,1,0,0,0,0,0,CONSORCIO CARMELO,,0.0,ACTIVO,HABIDO,0,0,0,0,0,,,,CONSORCIO CARMELO,0,0,4,2,2,2,0.5,0.5,0.0,0.0,
10181420761,VELARDE SAGASTEGUI JUAN STALIN(*),1,1,1,0,0,0,0,0,VELARDE SAGASTEGUI JUAN STALIN(*),,0.0,ACTIVO,HABIDO,0,0,0,0,0,1.0,2.0,CONDORHUAMAN SUPA JESUS DANIEL,VELARDE SAGASTEGUI JUAN STALIN(*),0,0,17,13,7,10,0.4117647058823529,0.5882352941176471,0.0,0.0,
10182053321,RAFAEL LEAN FERNANDO(*),3,3,1,0,1,0,0,0,RAFAEL LEAN FERNANDO(*),,0.0,ACTIVO,HABIDO,0,0,0,0,0,,,,RAFAEL LEAN FERNANDO(*),3,2,27,12,17,10,0.6296296296296297,0.37037037037037035,0.0,0.0,
10199424039,TOVAR HUANCA ELMER RAUL,1,1,0,0,0,0,0,0,TOVAR HUANCA ELMER RAUL,,0.0,ACTIVO,HABIDO,0,0,0,0,0,,,,TOVAR HUANCA ELMER RAUL,0,0,4,3,3,1,0.75,0.25,0.0,0.0,
10200447331,CONSORCIO CHECA CONSULTORES,2,2,1,0,1,0,0,0,CONSORCIO SUPERVISOR ALPHA,,0.0,ACTIVO,HABIDO,0,0,0,0,0,2.0,2.0,CONDORHUAMAN SUPA JESUS DANIEL,CONSORCIO CHECA CONSULTORES,3,2,27,18,15,12,0.5555555555555556,0.4444444444444444,0.0,0.0,
10200957721,CONSORCIO SUPERVISOR MINECON,1,1,1,0,0,0,0,0,CONSORCIO SUPERVISOR MINECON,,0.0,ACTIVO,HABIDO,0,0,0,0,0,,,,CONSORCIO SUPERVISOR MINECON,0,0,6,4,2,4,0.3333333333333333,0.6666666666666666,0.0,0.0,
10214241400,BORDA OSORIO JUAN FERNANDO,1,1,0,0,0,0,0,0,BORDA OSORIO JUAN FERNANDO,,0.0,ACTIVO,HABIDO,0,0,0,0,0,,,,BORDA OSORIO JUAN FERNANDO,0,0,2,1,1,1,0.5,0.5,0.0,0.0,
10214267204,YAÑEZ RODRIGUEZ JESUS DANIEL,1,1,0,0,1,0,0,0,YAÑEZ RODRIGUEZ JESUS DANIEL,,0.0,ACTIVO,HABIDO,0,0,0,0,0,,,,YAÑEZ RODRIGUEZ JESUS DANIEL,3,2,10,7,7,3,0.7,0.3,0.0,0.0,
10215363011,MARCILLA MIRANDA MARIANO PERCY,1,1,0,0,0,0,0,0,MARCILLA MIRANDA MARIANO PERCY,,0.0,ACTIVO,HABIDO,0,0,0,0,0,,,,MARCILLA MIRANDA MARIANO PERCY,0,0,9,8,8,1,0.8888888888888888,0.1111111111111111,0.0,0.0,
10220763001,HUAYHUA ESPINOZA FELICIANO(*),1,1,1,0,0,0,0,0,HUAYHUA ESPINOZA FELICIANO(*),,0.0,ACTIVO,HABIDO,0,0,0,0,0,,,,HUAYHUA ESPINOZA FELICIANO(*),0,0,5,3,3,2,0.6,0.4,0.0,0.0,
10225080530,MARTINEZ QUISPE JULIO VICTOR,1,1,0,0,0,0,0,0,MARTINEZ QUISPE JULIO VICTOR,,0.0,ACTIVO,HABIDO,0,0,0,0,0,,,,MARTINEZ QUISPE JULIO VICTOR,0,0,10,8,8,2,0.8,0.2,0.0,0.0,
10238544608,AEDO BELLOTA LUIS DAVID,1,1,0,0,0,0,0,0,AEDO BELLOTA LUIS DAVID,,0.0,ACTIVO,HABIDO,0,0,0,0,0,,,,AEDO BELLOTA LUIS DAVID,0,0,2,1,1,1,0.5,0.5,0.0,0.0,
10238827928,CONSORCIO VIAL CAYLLOMA,1,1,1,0,0,0,0,0,CONSORCIO VIAL CAYLLOMA,,0.0,ACTIVO,HABIDO,0,0,0,0,0,,,,CONSORCIO VIAL CAYLLOMA,0,0,4,2,2,2,0.5,0.5,1.0,1.0,8:30
10239167271,MIRANDA FARFAN SAMUEL,2,2,1,0,0,0,0,0,MIRANDA FARFAN SAMUEL(*),,0.0,ACTIVO,HABIDO,0,0,0,0,0,,,,MIRANDA FARFAN SAMUEL,0,0,12,7,7,5,0.5833333333333334,0.4166666666666667,0.0,0.0,
10239234840,CONSORCIO INGENIERIA DE PUENTES,1,1,1,0,0,0,0,0,CONSORCIO INGENIERIA DE PUENTES,,0.0,ACTIVO,HABIDO,0,0,0,0,0,,,,CONSORCIO INGENIERIA DE PUENTES,0,0,13,7,4,9,0.3076923076923077,0.6923076923076923,0.0,0.0,
10246727819,CHAMPI YANQUI LUIS,1,1,0,0,0,0,0,0,CHAMPI YANQUI LUIS,,0.0,ACTIVO,HABIDO,0,0,0,0,0,1.0,1.0,YIP AYALA MIGUEL ANGEL,CHAMPI YANQUI LUIS,0,0,16,12,11,5,0.6875,0.3125,0.0,0.0,
10255871124,BENDAYAN MIGUEL JOSE LUIS(*),1,1,1,0,0,0,1,0,BENDAYAN MIGUEL JOSE LUIS(*),,0.0,ACTIVO,HABIDO,0,0,0,0,0,1.0,1.0,PADILLA PINCHI NATALY ROOS,BENDAYAN MIGUEL JOSE LUIS(*),3,2,6,4,4,2,0.6666666666666666,0.3333333333333333,0.0,0.0,
10266263649,CONSORCIO AGUA,1,1,1,0,0,0,0,0,CONSORCIO AGUA,,0.0,ACTIVO,PENDIENTE,0,0,0,0,0,1.0,6.0,BECERRA RIVERA JORGE ENRIQUE,CONSORCIO AGUA,0,0,47,43,43,4,0.9148936170212766,0.0851063829787234,0.0,0.0,
10267161823,RODRIGUEZ PAJARES WILLIAM FREDY(*),3,3,1,0,0,0,0,0,RODRIGUEZ PAJARES WILLIAM FREDY(*),,0.0,ACTIVO,HABIDO,0,0,0,0,0,1.0,3.0,DUEÑAS BRAVO DAVID ROY,RODRIGUEZ PAJARES WILLIAM FREDY(*),0,0,28,16,17,11,0.6071428571428571,0.39285714285714285,1.0,1.0,9:00
10267226933,SUPERVISOR SAYTOCOHA,1,1,1,0,0,0,0,0,SUPERVISOR SAYTOCOHA,,0.0,ACTIVO,HABIDO,0,0,0,0,0,,,,SUPERVISOR SAYTOCOHA,0,0,11,8,4,7,0.36363636363636365,0.6363636363636364,1.0,1.0,9:00
10277185534,CONSORCIO COMPANY,1,1,1,0,0,0,0,0,CONSORCIO COMPANY,,0.0,ACTIVO,HABIDO,0,0,0,0,0,1.0,1.0,QUISPE MONDRAGON NILO NINIVE,CONSORCIO COMPANY,0,0,32,29,24,8,0.75,0.25,0.0,0.0,
10277207171,CASTRO LOPEZ EDWIN(*),1,1,1,0,0,0,0,0,CASTRO LOPEZ EDWIN(*),900000.0,900000.0,ACTIVO,HABIDO,0,0,0,0,0,,,,CASTRO LOPEZ EDWIN(*),0,0,5,3,3,2,0.6,0.4,0.0,0.0,
10282442243,BARRIENTOS QUISPE HENRI(*),2,2,1,0,0,0,0,0,BARRIENTOS QUISPE HENRI(*),,0.0,ACTIVO,HABIDO,0,0,0,0,0,1.0,2.0,TANTAPOMA CELESTINO CARLOS ENRIQUE,BARRIENTOS QUISPE HENRI(*),0,0,20,14,10,10,0.5,0.5,0.0,0.0,
10285910043,SGS,1,1,1,0,0,0,0,0,SGS,12743219.9,12743219.9,ACTIVO,HABIDO,0,0,0,0,0,1.0,9.0,PAULINO CABEZA ISIDORO NEON,SGS,0,0,68,46,41,27,0.6029411764705882,0.39705882352941174,0.0,0.0,
10296284322,CERRILLO PEZO LUZ VIOLETA(*),1,1,1,0,0,0,0,0,CERRILLO PEZO LUZ VIOLETA(*),,0.0,ACTIVO,HABIDO,0,0,0,0,0,,,,CERRILLO PEZO LUZ VIOLETA(*),0,0,7,5,5,2,0.7142857142857143,0.2857142857142857,0.0,0.0,
10296325886,MAMANI QUISPE JOSE LUIS,1,1,0,0,0,0,0,0,MAMANI QUISPE JOSE LUIS,,0.0,ACTIVO,HABIDO,0,0,0,0,0,,,,MAMANI QUISPE JOSE LUIS,0,0,2,1,1,1,0.5,0.5,0.0,0.0,
10296539967,ABARCA QUISPE AMILCAR(*),1,1,1,0,0,0,0,0,ABARCA QUISPE AMILCAR(*),,0.0,ACTIVO,HABIDO,0,0,0,0,0,,,,ABARCA QUISPE AMILCAR(*),0,0,4,2,2,2,0.5,0.5,1.0,1.0,8:30
10297077533,GUTIERREZ BORDA EDGAR ROBERT,1,1,0,0,0,0,0,0,GUTIERREZ BORDA EDGAR ROBERT,,0.0,ACTIVO,HABIDO,0,0,0,0,0,,,,GUTIERREZ BORDA EDGAR ROBERT,0,0,2,1,1,1,0.5,0.5,0.0,0.0,
10297108706,CONSORCIO ARDECO,1,1,1,0,0,0,0,0,CONSORCIO ARDECO,,0.0,ACTIVO,NO HALLADO,0,0,0,0,0,,,,CONSORCIO ARDECO,0,0,7,5,5,2,0.7142857142857143,0.2857142857142857,0.0,0.0,
10311863652,CONSORCIO IRRIGACION SISA,1,1,1,0,0,0,0,0,CONSORCIO IRRIGACION SISA,,0.0,ACTIVO,HABIDO,0,0,0,0,0,1.0,3.0,MARTINEZ ÑAHUI SAIDA CARMEN,CONSORCIO IRRIGACION SISA,0,0,4,2,2,2,0.5,0.5,0.0,0.0,
10316063484,CONSORCIO CONSULTORIA JAÉN,1,1,1,0,0,0,0,0,CONSORCIO CONSULTORIA JAÉN,,0.0,ACTIVO,HABIDO,0,0,0,0,0,,,,CONSORCIO CONSULTORIA JAÉN,0,0,7,5,4,3,0.5714285714285714,0.42857142857142855,0.0,0.0,
10316638215,CONSORCIO CHECA CONSULTORES,1,1,1,0,0,0,0,0,CONSORCIO CHECA CONSULTORES,,0.0,ACTIVO,HABIDO,0,0,0,0,0,1.0,2.0,CONDORHUAMAN SUPA SAUL WILMER,CONSORCIO CHECA CONSULTORES,0,0,19,14,7,12,0.3684210526315789,0.631578947368421,0.0,0.0,
10321254611,LEON ORDOÑEZ BRUMEL MISAEL,1,1,0,0,0,0,0,0,LEON ORDOÑEZ BRUMEL MISAEL,,0.0,ACTIVO,HABIDO,0,0,0,0,0,,,,LEON ORDOÑEZ BRUMEL MISAEL,0,0,2,1,1,1,0.5,0.5,0.0,0.0,
10329220805,CONSORCIO PROYECTO MANCHAY,1,1,1,0,0,0,0,0,CONSORCIO PROYECTO MANCHAY,,0.0,ACTIVO,HABIDO,0,0,0,0,0,,,,CONSORCIO PROYECTO MANCHAY,0,0,12,9,8,4,0.6666666666666666,0.3333333333333333,0.0,0.0,
10329618221,BOTELLO ALVA WALTER ALFREDO,1,1,0,0,0,0,0,0,BOTELLO ALVA WALTER ALFREDO,,0.0,ACTIVO,HABIDO,0,0,0,0,0,,,,BOTELLO ALVA WALTER ALFREDO,0,0,2,1,1,1,0.5,0.5,0.0,0.0,
10329838035,ESPINOSA ORELLANA JOHAN HUMBERTO(*),1,1,1,0,0,0,0,0,ESPINOSA ORELLANA JOHAN HUMBERTO(*),,0.0,ACTIVO,HABIDO,0,0,0,0,0,1.0,1.0,VIDAL PALOMINO MARITZA MARCELA,ESPINOSA ORELLANA JOHAN HUMBERTO(*),0,0,8,5,5,3,0.625,0.375,0.0,0.0,
10329924942,MARIN VILCHEZ JAVIER ALEXIS,1,1,0,0,0,0,0,0,MARIN VILCHEZ JAVIER ALEXIS,,0.0,ACTIVO,HABIDO,0,0,0,0,0,,,,MARIN VILCHEZ JAVIER ALEXIS,0,0,2,1,1,1,0.5,0.5,0.0,0.0,
10401312400,CONSORCIO WM HOSPITALES,1,1,1,0,0,0,0,0,CONSORCIO WM HOSPITALES,,0.0,ACTIVO,HABIDO,0,0,0,0,0,,,,CONSORCIO WM HOSPITALES,0,0,10,8,5,5,0.5,0.5,0.0,0.0,
10402087442,TEJEDA VASQUEZ ROBERTO MISAEL                                                                       ,1,1,0,0,0,0,0,0,TEJEDA VASQUEZ ROBERTO MISAEL                                                                       ,,0.0,ACTIVO,HABIDO,0,0,0,0,0,,,,TEJEDA VASQUEZ ROBERTO MISAEL                                                                       ,0,0,2,1,1,1,0.5,0.5,0.0,0.0,
10402362427,FLORES VILLANUEVA ROBERTO CARLOS(*),1,1,1,0,0,0,0,0,FLORES VILLANUEVA ROBERTO CARLOS(*),,0.0,ACTIVO,HABIDO,0,0,0,0,0,,,,FLORES VILLANUEVA ROBERTO CARLOS(*),0,0,6,4,4,2,0.6666666666666666,0.3333333333333333,0.0,0.0,
10404313598,CONSORCIO LAS REPRESAS,1,1,1,0,0,0,0,0,CONSORCIO LAS REPRESAS,,0.0,ACTIVO,HABIDO,0,0,0,0,0,1.0,2.0,HUERTAS JARA ALEXANDER PRIMITIVO,CONSORCIO LAS REPRESAS,0,0,29,24,5,24,0.1724137931034483,0.8275862068965517,0.0,0.0,
10404371865,MURRIETA CORIAT WESTLY REYNERIO(*),2,2,1,0,0,0,0,0,MURRIETA CORIAT WESTLY REYNERIO(*),,0.0,ACTIVO,HABIDO,0,0,0,0,0,,,,MURRIETA CORIAT WESTLY REYNERIO(*),0,0,11,6,7,4,0.6363636363636364,0.36363636363636365,0.0,0.0,
10408417479,CONSORCIO ESTUDIO F & J,4,4,1,0,0,0,0,0,CONSULTORES ASOCIADOS DEL ORIENTE,,0.0,ACTIVO,HABIDO,0,0,0,0,0,1.0,1.0,FLORES RUDAS NELLY MARISOL,CONSORCIO ESTUDIO F & J,0,0,46,30,32,14,0.6956521739130435,0.30434782608695654,0.0,0.0,
10409177579,RIBBECK CHUNGA JIMMY ROBERTH,1,1,0,0,0,0,0,0,RIBBECK CHUNGA JIMMY ROBERTH,,0.0,ACTIVO,HABIDO,0,0,0,0,0,,,,RIBBECK CHUNGA JIMMY ROBERTH,0,0,2,1,1,1,0.5,0.5,0.0,0.0,
10409229331,CONSORCIO LA PLOMADA,1,1,1,0,0,0,0,0,CONSORCIO LA PLOMADA,,0.0,ACTIVO,HABIDO,0,0,0,0,0,1.0,1.0,DAVILA AMASIFUEN JACK RANDY,CONSORCIO LA PLOMADA,0,0,4,2,2,2,0.5,0.5,0.0,0.0,
10410084827,SALINAS RETO PATRICIA INES,2,2,0,0,0,0,0,0,SALINAS RETO PATRICIA INES,,0.0,ACTIVO,HABIDO,0,0,0,0,0,,,,SALINAS RETO PATRICIA INES,0,0,5,2,3,2,0.6,0.4,0.0,0.0,
10413692682,CONSULTORES ASOCIADOS DEL ORIENTE,2,2,1,0,0,0,0,0,LAM CONSULTORES,,0.0,ACTIVO,HABIDO,0,0,0,1,0,,,,CONSULTORES ASOCIADOS DEL ORIENTE,1,1,21,10,13,8,0.6190476190476191,0.38095238095238093,0.0,0.0,
10416076702,DIOSES GARRIDO EDWIM FRANCISCO(*),1,1,1,0,0,0,0,0,DIOSES GARRIDO EDWIM FRANCISCO(*),,0.0,ACTIVO,HABIDO,0,0,0,0,0,,,,DIOSES GARRIDO EDWIM FRANCISCO(*),0,0,6,4,4,2,0.6666666666666666,0.3333333333333333,0.0,0.0,
10416449177,MENDOZA VIDAL CESAR AUGUSTO,3,3,0,0,0,0,0,0,MENDOZA VIDAL CESAR AUGUSTO,,0.0,ACTIVO,HABIDO,0,0,0,0,0,,,,MENDOZA VIDAL CESAR AUGUSTO,0,0,38,31,33,5,0.868421052631579,0.13157894736842105,0.0,0.0,
10417310245,CONSORCIO SUPERVISOR DEL SUR,1,1,1,0,0,0,0,0,CONSORCIO SUPERVISOR DEL SUR,,0.0,ACTIVO,HABIDO,0,0,0,0,0,1.0,4.0,PACCHA RUFASTO JOSE ROBERTO,CONSORCIO SUPERVISOR DEL SUR,0,0,11,8,4,7,0.36363636363636365,0.6363636363636364,0.0,0.0,
10421455304,PINEDA MENESES SAMUEL MOISES,1,1,0,0,0,0,0,0,PINEDA MENESES SAMUEL MOISES,,0.0,ACTIVO,HABIDO,0,0,0,0,0,,,,PINEDA MENESES SAMUEL MOISES,0,0,13,10,6,7,0.46153846153846156,0.5384615384615384,0.0,0.0,
10422448018,CONSORCIO VIAL DEL NORTE,1,1,1,0,0,0,0,0,CONSORCIO VIAL DEL NORTE,,0.0,ACTIVO,HABIDO,0,0,0,0,0,1.0,1.0,CHOLAN LLAJARUNA NELSON FREDDY,CONSORCIO VIAL DEL NORTE,0,0,4,2,2,2,0.5,0.5,0.0,0.0,
10423112099,CONSORCIO BETHEL,1,1,1,0,1,0,0,0,CONSORCIO BETHEL,,0.0,ACTIVO,HABIDO,0,0,0,0,0,1.0,1.0,FUSTAMANTE BENAVIDEZ CESAR ELADIO,CONSORCIO BETHEL,3,2,15,11,6,9,0.4,0.6,0.0,0.0,
10427430320,CONDOR CARHUAMACA JESUS ALEJANDRO(*),1,1,1,0,0,0,0,0,CONDOR CARHUAMACA JESUS ALEJANDRO(*),,0.0,ACTIVO,HABIDO,0,0,0,0,0,,,,CONDOR CARHUAMACA JESUS ALEJANDRO(*),0,0,4,2,2,2,0.5,0.5,0.0,0.0,
10431681931,SAAVEDRA HOLGUIN FRANCISCO JAVIER(*),2,2,1,0,0,0,0,0,SAAVEDRA HOLGUIN FRANCISCO JAVIER(*),,0.0,ACTIVO,HABIDO,0,0,0,0,0,,,,SAAVEDRA HOLGUIN FRANCISCO JAVIER(*),0,0,12,6,8,4,0.6666666666666666,0.3333333333333333,0.0,0.0,
10433574309,CONSORCIO Z2B,1,1,1,0,0,0,0,0,CONSORCIO Z2B,1220540.82,1220540.82,ACTIVO,HABIDO,0,0,0,0,0,,,,CONSORCIO Z2B,0,0,5,3,3,2,0.6,0.4,0.0,0.0,
10434381288,SUPERVISOR SAYTOCOHA,1,1,1,0,0,0,0,0,SUPERVISOR SAYTOCOHA,,0.0,ACTIVO,HABIDO,0,0,0,0,0,,,,SUPERVISOR SAYTOCOHA,0,0,7,4,4,3,0.5714285714285714,0.42857142857142855,1.0,1.0,9:00
10434632329,GAMARRA TUCO PAULO CESAR,1,1,0,0,0,0,0,0,GAMARRA TUCO PAULO CESAR,3784946.74,3784946.74,ACTIVO,HABIDO,0,0,0,0,0,,,,GAMARRA TUCO PAULO CESAR,0,0,6,5,5,1,0.8333333333333334,0.16666666666666666,0.0,0.0,
10444248535,CONSORCIO SUPERVISOR PUENTE AÑASHUAYCO,3,3,1,0,0,0,0,0,CONSORCIO SUPERVISOR PUENTE PACCHA,,0.0,ACTIVO,HABIDO,0,0,0,0,0,3.0,2.0,BECERRA GUEVARA RICARDO LENIN,CONSORCIO SUPERVISOR PUENTE AÑASHUAYCO,0,0,45,26,28,17,0.6222222222222222,0.37777777777777777,0.0,0.0,
10446381330,MENDOZA TERRONES ALEX VLADIMIR(*),1,1,1,0,0,0,0,0,MENDOZA TERRONES ALEX VLADIMIR(*),,0.0,ACTIVO,HABIDO,0,0,0,0,0,,,,MENDOZA TERRONES ALEX VLADIMIR(*),0,0,10,6,6,4,0.6,0.4,0.0,0.0,
10448235039,RIVERA FERNANDEZ EDSON(*),1,1,1,0,0,0,0,0,RIVERA FERNANDEZ EDSON(*),500000.0,500000.0,ACTIVO,HABIDO,0,0,0,0,0,1.0,2.0,SANTA CRUZ DIAZ YNGRID YURIDIA,RIVERA FERNANDEZ EDSON(*),0,0,18,12,6,12,0.3333333333333333,0.6666666666666666,0.0,0.0,
10453522542,POMA PUMACANCHARI JUAN IRWIN(*),2,2,1,0,0,0,0,0,POMA PUMACANCHARI JUAN IRWIN(*),,0.0,ACTIVO,HABIDO,0,0,0,0,0,,,,POMA PUMACANCHARI JUAN IRWIN(*),0,0,24,18,17,7,0.7083333333333334,0.2916666666666667,0.0,0.0,
10454278033,CONSORCIO KUNTUR,1,1,1,0,0,0,0,0,CONSORCIO KUNTUR,,0.0,ACTIVO,HABIDO,0,0,0,0,0,,,,CONSORCIO KUNTUR,0,0,18,11,6,12,0.3333333333333333,0.6666666666666666,0.0,0.0,
10700275260,CHAVARRIA COTRINA JOEL EFRAIN,1,1,0,0,0,0,0,0,CHAVARRIA COTRINA JOEL EFRAIN,,0.0,ACTIVO,HABIDO,0,0,0,0,0,,,,CHAVARRIA COTRINA JOEL EFRAIN,0,0,2,1,1,1,0.5,0.5,0.0,0.0,
10806675895,CONSORCIO SUPERVISOR DEL SUR,1,1,1,0,0,0,0,0,CONSORCIO SUPERVISOR DEL SUR,,0.0,ACTIVO,HABIDO,0,0,0,0,0,1.0,4.0,PACCHA HUAMANI PABLO ROBERTO,CONSORCIO SUPERVISOR DEL SUR,0,0,14,10,4,10,0.2857142857142857,0.7142857142857143,0.0,0.0,
20100153671,LAGESA INGENIEROS CONSULTORES S.A.,1,1,0,0,0,0,1,0,LAGESA INGENIEROS CONSULTORES S.A.,,0.0,ACTIVO,HABIDO,0,0,0,1,0,1.0,20.0,HIJAR DIAZ MARTHA MATILDE,LAGESA INGENIEROS CONSULTORES S.A.,4,2,37,27,26,11,0.7027027027027027,0.2972972972972973,0.0,0.0,
20100205816,CONSULTORA E INMOBILIARIA VOLCAN S A,1,1,0,0,0,0,0,0,CONSULTORA E INMOBILIARIA VOLCAN S A,,0.0,ACTIVO,HABIDO,0,0,0,0,0,1.0,1.0,RIVERA CHICATA JOSE LUIS,CONSULTORA E INMOBILIARIA VOLCAN S A,0,0,6,5,1,5,0.16666666666666666,0.8333333333333334,1.0,1.0,8:30
20100209137,OSCAR MANUEL DELGADO PUENTE DE LA VEGA S .C.R.L.(*),1,1,1,0,0,0,0,0,OSCAR MANUEL DELGADO PUENTE DE LA VEGA S .C.R.L.(*),113220245.2,113220245.2,ACTIVO,HABIDO,0,0,0,0,0,1.0,6.0,DELGADO CORRALES MANUEL,OSCAR MANUEL DELGADO PUENTE DE LA VEGA S .C.R.L.(*),0,0,6,4,4,2,0.6666666666666666,0.3333333333333333,0.0,0.0,
20100318696,HV CONTRATISTAS S.A.(*),2,2,1,0,0,0,1,0,HV CONTRATISTAS S.A.(*),526114164.0,-1894402107.0,ACTIVO,HABIDO,0,0,0,0,0,2.0,21.0,ZAVALA FLOREZ ESTRADA MARIA PIA,HV CONTRATISTAS S.A.(*),3,2,12,4,6,6,0.5,0.5,0.0,0.0,
20100333571,Consorcio Hospitalario Perú Centro,1,1,1,0,0,0,1,0,Consorcio Hospitalario Perú Centro,,0.0,ACTIVO,HABIDO,0,0,0,0,0,1.0,5.0,ECHANDIA MORENO DANITZA ZULEMA,Consorcio Hospitalario Perú Centro,3,2,10,6,4,6,0.4,0.6,0.0,0.0,
20100356270,GMI S A INGENIEROS CONSULTORES,2,2,0,0,0,0,0,0,GMI S A INGENIEROS CONSULTORES,,0.0,ACTIVO,HABIDO,0,0,0,0,0,2.0,25.0,HIGA AZAMA CLAUDIA PATRICIA,GMI S A INGENIEROS CONSULTORES,0,0,41,30,24,17,0.5853658536585366,0.4146341463414634,0.0,0.0,
20100878489,CORPORACION PERUANA DE INGENIERIA SOCIEDAD ANONIMA - CORPEI S.A.,3,3,1,0,0,0,1,0,CORPORACION PERUANA DE INGENIERIA SOCIEDAD ANONIMA - CORPEI S.A.(*),,0.0,ACTIVO,HABIDO,0,0,0,0,0,3.0,5.0,GARAYAR JURADO LUIS ORLANDO,CORPORACION PERUANA DE INGENIERIA SOCIEDAD ANONIMA - CORPEI S.A.,3,2,51,34,29,22,0.5686274509803921,0.43137254901960786,0.0,0.0,
20100913225,JNR CONSULTORES SOCIEDAD ANONIMA,1,1,0,0,0,0,1,0,JNR CONSULTORES SOCIEDAD ANONIMA,,0.0,ACTIVO,HABIDO,0,0,0,0,1,1.0,3.0,NORIEGA ROMERO ROXANA GUADALUPE,JNR CONSULTORES SOCIEDAD ANONIMA,4,2,15,13,13,2,0.8666666666666667,0.13333333333333333,1.0,1.0,10:00
20101029442,CONSORCIO BIOMEDICO VIDENA,1,1,1,0,1,0,1,0,CONSORCIO BIOMEDICO VIDENA,1739623883.0,1739623883.0,ACTIVO,HABIDO,0,0,0,0,0,1.0,9.0,WOLL PLENGE STEPHAN,CONSORCIO BIOMEDICO VIDENA,3,2,13,10,2,11,0.15384615384615385,0.8461538461538461,0.0,0.0,
20101064191,CESEL S A,2,2,0,0,0,0,0,0,CESEL S A,,0.0,ACTIVO,HABIDO,0,0,0,0,0,2.0,18.0,ABUGATTAS ABUID JESUS GATTAS,CESEL S A,0,0,26,21,11,15,0.4230769230769231,0.5769230769230769,0.0,0.0,
20101086322,CONSORCIO SUPERVISOR HUALLABAMBA,1,1,1,0,0,0,0,0,CONSORCIO SUPERVISOR HUALLABAMBA,,0.0,ACTIVO,HABIDO,0,0,0,0,0,1.0,4.0,GUERRA CASTILLO EDUARDO MANUEL,CONSORCIO SUPERVISOR HUALLABAMBA,0,0,7,5,5,2,0.7142857142857143,0.2857142857142857,0.0,0.0,
20101102549,OFICINA DE INGENIERIA Y SERVICIOS TECNICOS S.A.(*),1,1,1,0,0,0,1,0,OFICINA DE INGENIERIA Y SERVICIOS TECNICOS S.A.(*),,0.0,ACTIVO,HABIDO,0,0,0,0,1,1.0,9.0,CHAVEZ ABAD DANILO EDUARDO,OFICINA DE INGENIERIA Y SERVICIOS TECNICOS S.A.(*),4,2,11,8,5,6,0.45454545454545453,0.5454545454545454,1.0,1.0,15:00
20101345018,HOB CONSULTORES S.A.,6,6,1,0,0,0,0,0,HOB CONSULTORES S.A.(*),,0.0,ACTIVO,HABIDO,0,0,0,1,0,6.0,5.0,GONZALEZ ROLDAN FRANCISCO JAVIER,HOB CONSULTORES S.A.,1,1,129,53,87,42,0.6744186046511628,0.32558139534883723,0.0,0.0,
20101884407,CONSORCIO EL EDEN,1,1,1,0,1,0,1,1,CONSORCIO EL EDEN,,0.0,ACTIVO,NO HALLADO,0,0,0,0,0,1.0,14.0,REYNA PEÑA MARIA TERESA,CONSORCIO EL EDEN,3,2,7,5,2,5,0.2857142857142857,0.7142857142857143,0.0,0.0,
